{
  "$schema_version": "0.1.0-demo",
  "$comment": "Демо-контракт даних ALTACO. Структура й ціна живуть тут; оперативний статус наявності — overlay із Google Sheets. Публікуються лише позиції з повним записом: фото, назва, тип, ціна, фініш. Обробки, розміри й роздрібні ціни (€/м²) внесено з прайс-таблиці складу.",
  "lines": [
    { "id": "sm-quartz", "name": "SM Quartz", "description": "Engineered surfaces — колекції, фініші, технічні документи" },
    { "id": "sm-marble", "name": "SM Marble", "description": "Engineered surfaces — колекції, фініші, технічні документи" },
    { "id": "bagnara-selection", "name": "Bagnara Selection", "description": "Преміальний натуральний камінь для проєктів" },
    { "id": "bagnara-kitchen", "name": "Bagnara Kitchen Selection", "description": "Матеріали для стільниць, кухонь і ванних" },
    { "id": "italian-stone", "name": "Italian Stone", "description": "Made in Italy — тег і фільтр, італійська компетенція" },
    { "id": "holovyne-labradorite", "name": "Головинський лабрадорит", "description": "Український камінь" }
  ],
  "materials": [
    {
      "id": "azul-macauba",
      "name": "Azul Macauba",
      "type": "natural_quartzite",
      "line": "italian-stone",
      "finish": "polished",
      "thicknesses_mm": [20],
      "slab_size_mm": { "w": 1930, "h": 3380 },
      "price_eur_m2": 1100,
      "tags": ["premium", "blue"],
      "published": true
    },
    {
      "id": "arabescatto-classico",
      "name": "Arabescatto Classico",
      "type": "natural_marble",
      "line": "italian-stone",
      "finish": "polished",
      "thicknesses_mm": [20],
      "slab_size_mm": { "w": 1660, "h": 2550 },
      "price_eur_m2": 380,
      "tags": ["made-in-italy", "marble", "white"],
      "published": true
    },
    {
      "id": "black-tempest",
      "name": "Black Tempest",
      "type": "natural_granite",
      "line": "bagnara-kitchen",
      "finish": "satinato",
      "thicknesses_mm": [20],
      "slab_size_mm": { "w": 1950, "h": 3300 },
      "price_eur_m2": 520,
      "tags": ["kitchen", "dark"],
      "published": true
    },
    {
      "id": "brown-silk",
      "name": "Brown Silk",
      "type": "natural_quartzite",
      "line": "bagnara-kitchen",
      "finish": "satinato",
      "thicknesses_mm": [20],
      "slab_size_mm": { "w": 1940, "h": 3120 },
      "price_eur_m2": 320,
      "tags": ["kitchen", "grey"],
      "published": true
    },
    {
      "id": "mystic-grey",
      "name": "Mystic Grey",
      "type": "natural_granite",
      "line": "holovyne-labradorite",
      "finish": "polished",
      "price_eur_m2": 0,
      "photo": "photos/mystic-grey.webp",
      "tags": ["ukraine", "grey"],
      "published": false,
      "$comment": "published: false — поза переліком матеріалів користувача; без фото, у каталог не потрапляє"
    },
    {
      "id": "moon-rock",
      "name": "Moon Rock",
      "type": "natural_quartzite",
      "line": "bagnara-kitchen",
      "finish": "pec",
      "thicknesses_mm": [20],
      "slab_size_mm": { "w": 1880, "h": 3260 },
      "price_eur_m2": 320,
      "tags": ["kitchen", "grey"],
      "published": true
    },
    {
      "id": "atlantic-stone",
      "name": "Atlantic Stone",
      "type": "natural_quartzite",
      "line": "bagnara-kitchen",
      "finish": "levigato",
      "thicknesses_mm": [20],
      "slab_size_mm": { "w": 1910, "h": 2610 },
      "price_eur_m2": 580,
      "tags": ["kitchen", "grey"],
      "published": true
    },
    {
      "id": "statuarietto",
      "name": "Statuarietto",
      "type": "natural_marble",
      "line": "italian-stone",
      "finish": "polished",
      "thicknesses_mm": [20],
      "slab_size_mm": { "w": 1900, "h": 3120 },
      "price_eur_m2": 440,
      "tags": ["made-in-italy", "white", "marble"],
      "published": true
    },
    {
      "id": "calacatta-gold",
      "name": "Calacatta Gold",
      "type": "natural_marble",
      "line": "italian-stone",
      "finish": "polished",
      "thicknesses_mm": [20],
      "slab_size_mm": { "w": 1940, "h": 2650 },
      "price_eur_m2": 580,
      "tags": ["made-in-italy", "white", "gold"],
      "published": true
    },
    {
      "id": "azul-aran",
      "name": "Azul Aran",
      "type": "natural_granite",
      "line": "bagnara-kitchen",
      "finish": "polished",
      "thicknesses_mm": [20],
      "slab_size_mm": { "w": 1930, "h": 2780 },
      "price_eur_m2": 300,
      "tags": ["kitchen", "grey", "granite"],
      "published": true
    }
  ],
  "availability_overlay": {
    "source": "google_sheets",
    "$comment": "Оперативний статус наявності (запит/резерв) підтягується окремо й не дублюється в ядрі"
  }
}
